{
  "schemaVersion": "1.0.0",
  "AppName": "planr-pipeline",
  "Version": "0.7.3",
  "Description": "Spec-driven AI software factory plugin for Claude Code",
  "Repository": "https://github.com/openplanr/planr-pipeline",
  "Language": "JavaScript (Node ESM)",
  "Framework": "Claude Code plugin",
  "RuntimeVersion": "Node 20+",
  "TestFramework": "node:test (stdlib) — SPEC-007 will introduce the suite",
  "DatabaseType": "",
  "ORM": "",
  "BuildCommand": "node --check conformance/runner.mjs",
  "TestCommand": "npm test",
  "LintCommand": "",
  "TypeCheckCommand": "",
  "ActiveStackFiles": [],
  "DoNotUse": [
    "Third-party npm packages in conformance/runner.mjs (stdlib only — preserves zero-dep posture)"
  ],
  "MustPreserve": [
    "agents/*.md YAML frontmatter `tools:` field — manifest-enforced security boundary"
  ]
}
